{
  "title": "CacheBlend: Fast Large Language Model Serving for RAG with Cached Knowledge Fusion",
  "components": [
    {
      "name": "KVCacheStore",
      "purpose": "Maps each input text chunk (identified by hash) to its pre-computed per-layer KV cache, persisted on a single storage device (CPU RAM or NVMe SSD), with LRU eviction when full. Enables retrieval of pre-computed KV for any reused chunk during inference and async write-back for new chunks.",
      "inputs": [
        {"name": "text_chunk", "shape_or_type": "str (chunk_size <= ~512 tokens)", "description": "A text chunk produced by Langchain chunking; key for the hash table."},
        {"name": "layer_id", "shape_or_type": "int in [0, num_layers)", "description": "Layer index requested by fetch_kv()."}
      ],
      "outputs": [
        {"name": "kv_cache_layer", "shape_or_type": "Tuple[K, V] where K, V have shape (num_kv_heads, chunk_len, head_dim)", "description": "Per-layer K and V tensors for the chunk; returned as -1 / sentinel if absent."}
      ],
      "algorithm_source": {
        "paper_section": "Section 5.1 (KV cache store) and Section 6 (Managing KV cache)",
        "equation_numbers": [],
        "appendix_section": null
      },
      "hyperparameters": {
        "chunk_size_tokens": 512,
        "samsum_chunk_size_tokens": "200-400",
        "eviction_policy": "LRU",
        "hash_table_location": "CPU (about 16 MB for 1 million chunks)",
        "storage_levels": "single level: CPU RAM or NVMe SSD",
        "measured_ssd_throughput_GBps": 4.8,
        "writeback_mode": "async background thread via torch.save",
        "load_from_disk_call": "torch.load",
        "load_from_cpu_call": "torch.cuda",
        "hash_function": "vllm.utils.hashing.sha256_cbor over (parent_hash, token_id_block) [RESOLVED via official_code, LMCache lmcache/v1/token_database.py]",
        "kv_dtype_on_disk": "model native activation dtype (fp16 / bf16); no quantization [RESOLVED via official_code, vllm_blend xformers.py:229]",
        "on_disk_file_layout": "per (chunk_hash, layer_id) shard; CacheEngineKey = model@world@worker@chunk_hash@dtype@layer_id [RESOLVED via official_code, LMCache lmcache/utils.py:373]"
      },
      "unknowns": [
        "[LOW-CONF] Exact size threshold that triggers LRU eviction (capacity not specified in paper or code; assume sized to fit eval working set ~25 GB on 1 TB NVMe so eviction is effectively off during measurement)."
      ]
    },
    {
      "name": "PositionalEncodingRecovery",
      "purpose": "Recovers RoPE positional encodings when a pre-computed KV cache (originally encoded at a different absolute position) is concatenated into a new context at a new absolute position. The recovery exploits the fact that RoPE attention only depends on relative position.",
      "inputs": [
        {"name": "K_pre", "shape_or_type": "Tensor (num_kv_heads, chunk_len, head_dim)", "description": "Pre-computed K vectors for a chunk, stored in pre-rotation form (rotation applied lazily at new positions)."},
        {"name": "original_position", "shape_or_type": "int", "description": "Absolute position m at which K was originally encoded (effectively 0 since K is stored without rotation in the official impl)."},
        {"name": "new_position", "shape_or_type": "int", "description": "Absolute position m' at which the chunk is placed in the concatenated input."}
      ],
      "outputs": [
        {"name": "K_pre_repositioned", "shape_or_type": "Tensor (num_kv_heads, chunk_len, head_dim)", "description": "K vectors with RoPE applied at the new absolute positions so that attention scores depend only on relative distance."}
      ],
      "algorithm_source": {
        "paper_section": "Appendix A (N-dimensional positional recovery)",
        "equation_numbers": ["RoPE 2D rotation", "Proposition A.1 (q_{m+l}.k_m relative-position identity)"],
        "appendix_section": "A"
      },
      "hyperparameters": {
        "rope_base_theta_formula": "theta_i = 10000^(-2i/d) for i in [0, d/2-1]",
        "rotation_block_size": 2,
        "implementation": "explicit forward RoPE rotation of loaded K with new absolute positions; calls self.rotary_emb(new_positions, fake_q, K_pre); per-layer, on-the-fly inside LlamaAttention.forward [RESOLVED via official_code, vllm_blend llama.py:174-179]",
        "non_rope_models": "out of scope; deferred to future work (Mamba, Griffin) [RESOLVED via paper, Section 9]"
      },
      "unknowns": []
    },
    {
      "name": "SelectiveKVRecompute",
      "purpose": "On each transformer layer, recompute Q, K, V only for the currently selected HKVD tokens, while reusing the loaded pre-computed K/V for the remaining tokens. Produces the layer's output embeddings used as input to the next layer.",
      "inputs": [
        {"name": "input_tensor", "shape_or_type": "Tensor (batch, seq_len, hidden_dim)", "description": "Hidden state input to the current transformer layer for the full concatenated context."},
        {"name": "input_metadata", "shape_or_type": "vLLM InputMetadata", "description": "Original vLLM layer metadata needed for prefill (positions, attn metadata, etc.)."},
        {"name": "HKVD_indices", "shape_or_type": "LongTensor (num_selected,)", "description": "Indices of the selected HKVD tokens whose KV will be recomputed at this layer."},
        {"name": "check_flag", "shape_or_type": "bool", "description": "If True, this layer will (re)select HKVD tokens based on deviation between newly computed and loaded KV. If False, only the existing HKVD_indices are recomputed."},
        {"name": "KVCache_pre_layer", "shape_or_type": "Tuple[K_pre, V_pre] of shape (num_kv_heads, seq_len, head_dim)", "description": "Loaded pre-computed KV for this layer (after positional recovery)."}
      ],
      "outputs": [
        {"name": "output_tensor", "shape_or_type": "Tensor (batch, seq_len, hidden_dim)", "description": "Layer output, used as input to the next layer."},
        {"name": "KVCache_new_layer", "shape_or_type": "Tuple[K_new, V_new] of shape (num_kv_heads, seq_len, head_dim)", "description": "Per-layer KV cache where selected tokens have freshly recomputed K/V and others retain pre-computed K/V."},
        {"name": "HKVD_indices_next", "shape_or_type": "LongTensor (num_selected_next,)", "description": "Indices propagated to the next layer; if check_flag was True, may be updated to top-r% by KV deviation."}
      ],
      "algorithm_source": {
        "paper_section": "Section 4.2 (Selectively recomputing KV cache); Section 6 (prefill_layer interface)",
        "equation_numbers": ["Delta_kv(KV_i, KV_full_i)[j] = | KV_i[j] - KV_full_i[j] |"],
        "appendix_section": null
      },
      "hyperparameters": {
        "default_recompute_ratio_r_percent": 15,
        "compute_overhead_proportionality": "r% of full prefill compute per layer",
        "sweep_range_r_percent": "5 to 18 (Figure 16, Yi-34B)",
        "softmax_denominator_scope": "all keys / standard 1/sqrt(d_k) scaling; selected Q attends to full-length expanded K,V [RESOLVED via official_code, vllm_blend xformers.py:240-441]",
        "mask_expansion_strategy": "positional recovery applied per-layer on-the-fly before expansion [RESOLVED via official_code, vllm_blend llama.py:174-179]",
        "partial_kv_writeback": "in-place fancy-indexed assignment along seq dim (key_old[imp_indices] = key; value_old[imp_indices] = value), equivalent to index_copy_ [RESOLVED via official_code, vllm_blend xformers.py:240-245]"
      },
      "unknowns": []
    },
    {
      "name": "HKVDSelector",
      "purpose": "Identify the subset of tokens whose KV must be recomputed per layer (High-KV-Deviation, HKVD). Released implementation selects once at a single 'check layer' and reuses for all subsequent layers, instead of the gradual-decay schedule described qualitatively in the paper.",
      "inputs": [
        {"name": "V_new_layer_i", "shape_or_type": "Tensor (num_candidates, num_kv_heads, head_dim)", "description": "Newly computed V for the candidate set at the check layer."},
        {"name": "V_pre_layer_i", "shape_or_type": "Tensor (num_candidates, num_kv_heads, head_dim)", "description": "Pre-computed (loaded) V for the candidate set at the check layer (after positional recovery)."},
        {"name": "r_percent", "shape_or_type": "float", "description": "Target recompute ratio (single scalar in the released code, e.g. 0.15, 0.16, or 0.18)."}
      ],
      "outputs": [
        {"name": "HKVD_indices", "shape_or_type": "LongTensor (ceil(r% * num_candidates),)", "description": "Indices of top-r% tokens by per-token squared-L2 V-deviation; reused on all subsequent layers."}
      ],
      "algorithm_source": {
        "paper_section": "Section 4.3 (Selecting which tokens to recompute, Insight 1 and Insight 2, gradual-filtering scheme)",
        "equation_numbers": ["Delta_kv(KV_i, KV_full_i)[j] = sum over (head, head_dim) of (V_new[j] - V_pre[j])^2", "Selection rule: top-r% by V deviation"],
        "appendix_section": null
      },
      "hyperparameters": {
        "target_average_recompute_ratio_r_percent": 15,
        "quality_floor_r_star_percent": 15,
        "first_layer_candidate_set": "all tokens in the concatenated context",
        "schedule": "single check layer at decoder index 1; HKVD selected there is reused on all later layers [RESOLVED via official_code, vllm_blend llama.py:300 (check_layers:[1]) and 350-356]",
        "deviation_reduction": "per-token squared L2 norm of (V_new - V_pre), summed across head and head_dim axes [RESOLVED via official_code, vllm_blend xformers.py:210-211]",
        "deviation_tensor": "V only (not K, not concatenated [K;V]) [RESOLVED via official_code, vllm_blend xformers.py:210]",
        "check_flag_per_layer": "True only on layer index 1; False on all other layers (status 0/1/2 encoding) [RESOLVED via official_code, vllm_blend llama.py:350-356]"
      },
      "unknowns": []
    },
    {